{
  "schema_version": "workflow.monitor.v2",
  "run_id": "run-fixture-001",
  "policy": {
    "time_to_first_output_ms": 120000,
    "no_progress_timeout_ms": 300000,
    "role_timeout_ms": 2400000,
    "max_stall_retries": 1,
    "max_review_cycles": 2
  },
  "agents": [
    {
      "agent_id": "worker-001",
      "command": "dev-fix",
      "role_class": "worker",
      "runtime": "current-session",
      "provider": "local",
      "model": "inherit",
      "task_ids": [
        "T2"
      ],
      "filescope": [
        "src/example.js"
      ],
      "workspace_ref": null,
      "session_ref": null,
      "status": "done",
      "retry_count": 0,
      "budgets": {
        "time_to_first_output_ms": 180000,
        "no_progress_timeout_ms": 300000,
        "role_timeout_ms": 2400000
      },
      "started_at": "2026-01-01T00:00:00.000Z",
      "last_progress_at": "2026-01-01T00:01:00.000Z",
      "materialized_outputs": [
        ".agent-surface/workflows/run-fixture-001/monitor/worker-001.json"
      ]
    }
  ],
  "metrics": {
    "orchestration_time_ms": 1000,
    "implementation_time_ms": 5000,
    "verification_time_ms": 2000,
    "review_time_ms": 0,
    "stalls": 0,
    "retries": 0,
    "rework_cycles": 0
  }
}
